{
  "$schema": "http://json-schema.org/draft-07/schema#",
  "$id": "https://example.invalid/ui-motion-engine/storyboard.schema.json",
  "title": "UI Motion Engine Storyboard v1",
  "type": "object",
  "additionalProperties": false,
  "required": ["schemaVersion", "id", "fps", "output", "shots"],
  "properties": {
    "schemaVersion": {"const": 1},
    "id": {"type": "string", "minLength": 1},
    "fps": {"enum": [24, 25, 30, 60]},
    "output": {
      "type": "object", "additionalProperties": false,
      "required": ["width", "height"],
      "properties": {"width": {"type": "integer", "minimum": 320, "maximum": 7680}, "height": {"type": "integer", "minimum": 320, "maximum": 7680}}
    },
    "shots": {
      "type": "array", "minItems": 1,
      "items": {
        "type": "object", "additionalProperties": false,
        "required": ["id", "startFrame", "durationFrames", "method", "targetId", "effects"],
        "properties": {
          "id": {"type": "string", "minLength": 1},
          "startFrame": {"type": "integer", "minimum": 0},
          "durationFrames": {"type": "integer", "minimum": 1, "maximum": 7200},
          "method": {"enum": ["live", "raster", "recording"]},
          "targetId": {"type": "string", "minLength": 1},
          "caption": {"type": "string", "maxLength": 500},
          "effects": {
            "type": "array",
            "items": {
              "type": "object", "additionalProperties": false,
              "required": ["name", "startOffset", "durationFrames", "params"],
              "properties": {
                "name": {"enum": ["extract-and-return", "focus-glow", "spotlight-dim", "cta-pulse", "thumbnail-pop", "fire-particles", "typed-search", "orbit-cards", "logo-reveal", "camera-journey"]},
                "startOffset": {"type": "integer", "minimum": 0},
                "durationFrames": {"type": "integer", "minimum": 1},
                "params": {"type": "object"}
              }
            }
          },
          "warnings": {"type": "array", "items": {"type": "string"}}
        }
      }
    },
    "warnings": {"type": "array", "items": {"type": "string"}}
  }
}
